,anime_id,name,genre,type,episodes,rating,members
834,2593,Kara no Kyoukai 1: Fukan Fuukei,"Action, Mystery, Supernatural, Thriller",Movie,1,7.81,178880
836,32380,Kono Subarashii Sekai ni Shukufuku wo! OVA,"Comedy, Fantasy",OVA,1,7.81,46823
837,33263,Kubikiri Cycle: Aoiro Savant to Zaregototsukai,"Action, Drama, Mystery, Supernatural",OVA,8,7.82,19317
838,13203,Lupin the Third: Mine Fujiko to Iu Onna,"Action, Adventure, Comedy, Ecchi, Samurai, Seinen",TV,13,7.81,22796
839,2963,Minami-ke,"Comedy, School, Slice of Life",TV,13,7.81,105471
840,87,Mobile Suit Gundam: Char&#039;s Counterattack,"Drama, Mecha, Military, Sci-Fi, Space",Movie,1,7.81,19258
841,20,Naruto,"Action, Comedy, Martial Arts, Shounen, Super Power",TV,220,7.81,683297
842,31953,New Game!,"Comedy, Slice of Life",TV,12,7.81,91932
843,28069,Shigatsu wa Kimi no Uso: Moments,"Music, Shounen",OVA,1,7.81,41368
844,1002,Top wo Nerae 2! Diebuster,"Action, Comedy, Mecha, Sci-Fi, Space",OVA,6,7.81,38691
845,9471,Baka to Test to Shoukanjuu: Matsuri,"Comedy, School, Super Power",OVA,2,7.8,67684
846,150,Blood+,"Action, Drama, Horror, Military, Mystery, Supernatural, Vampire",TV,50,7.8,208321
847,60,Chrno Crusade,"Action, Demons, Historical, Romance, Supernatural",TV,24,7.8,140865
848,19671,Free!: FrFr - Short Movie,"Comedy, Sports",Special,7,7.8,35956
849,120,Fruits Basket,"Comedy, Drama, Fantasy, Romance, Shoujo, Slice of Life",TV,26,7.8,242553
850,74,Gakuen Alice,"Comedy, Magic, School, Shoujo",TV,26,7.8,52995
851,30364,Haikyuu!! Movie 2: Shousha to Haisha,"Comedy, Drama, School, Shounen, Sports",Movie,1,7.81,10558
852,8426,Hourou Musuko,"Drama, School, Slice of Life",TV,11,7.8,53426
854,2547,Shoukoujo Sara,"Drama, Historical, Shoujo, Slice of Life",TV,46,7.8,7515
855,22101,Soredemo Sekai wa Utsukushii,"Adventure, Fantasy, Romance, Shoujo",TV,12,7.8,99462
856,182,Tenkuu no Escaflowne,"Adventure, Fantasy, Mecha, Romance, Shoujo",TV,26,7.8,83437
858,28979,To LOVE-Ru Darkness 2nd,"Comedy, Ecchi, Harem, Romance, School, Sci-Fi, Shounen",TV,12,7.8,73909
859,16011,Tokyo Ravens,"Comedy, School, Shounen, Super Power, Supernatural",TV,24,7.8,171384
861,9062,Angel Beats! Specials,"Action, Comedy, School, Supernatural",Special,2,7.79,139013
862,477,Aria The Animation,"Fantasy, Sci-Fi, Shounen, Slice of Life",TV,13,7.79,76913
863,6772,Break Blade 1: Kakusei no Toki,"Action, Fantasy, Mecha, Military, Shounen",Movie,1,7.79,58184
865,5177,Denpa-teki na Kanojo,"Mystery, School, Thriller",OVA,2,7.79,85409
866,2229,Dragon Quest: Dai no Daibouken,"Adventure, Comedy, Demons, Fantasy, Magic, Martial Arts, Shounen",TV,46,7.79,8999
867,6927,Higashi no Eden Soushuuhen: Air Communication,"Comedy, Mystery, Romance",Movie,1,7.79,20059
868,4811,Ichigo Mashimaro Encore,"Comedy, Slice of Life",OVA,2,7.79,12790
869,13403,Inu x Boku SS Special,"Comedy, Shounen, Supernatural",Special,1,7.79,46803
870,228,Jigoku Shoujo,"Horror, Mystery, Psychological, Supernatural",TV,26,7.79,172415
872,24135,Nobunaga Concerto,"Historical, Romance, Shounen",TV,10,7.79,25167
873,8795,Panty &amp; Stocking with Garterbelt,"Action, Comedy, Ecchi, Parody, Supernatural",TV,13,7.79,157642
874,12021,Poyopoyo Kansatsu Nikki,"Comedy, Seinen, Slice of Life",TV,52,7.79,13832
876,1011,Ranma ½ Super,"Adventure, Comedy, Martial Arts, Romance, Shounen, Supernatural",OVA,3,7.79,9936
877,18119,Servant x Service,"Comedy, Slice of Life",TV,13,7.79,81037
878,2787,Shakugan no Shana II (Second),"Action, Drama, Fantasy, Romance, School, Supernatural",TV,24,7.79,184525
879,6046,Tales of Vesperia: The First Strike,"Action, Adventure, Fantasy, Magic, Military",Movie,1,7.79,30524
880,9000,Toaru Hikuushi e no Tsuioku,"Adventure, Military, Romance",Movie,1,7.79,28857
881,10717,Towa no Quon 6: Towa no Quon,"Action, Super Power, Supernatural",Movie,1,7.79,18624
882,31580,Ajin,"Action, Horror, Mystery, Seinen, Supernatural",TV,13,7.78,160972
883,31483,"Akagami no Shirayuki-hime: Nandemonai Takaramono, Kono Page","Drama, Fantasy, Romance, Shoujo",OVA,1,7.77,20749
884,531,Bishoujo Senshi Sailor Moon R: The Movie,"Drama, Magic, Romance, Shoujo",Movie,1,7.78,33682
885,4596,Code Geass: Hangyaku no Lelouch Special Edition Black Rebellion,"Action, Mecha, Military, School, Super Power",OVA,1,7.78,23285
886,1015,Full Metal Panic! The Second Raid: Wari to Hima na Sentaichou no Ichinichi,Comedy,Special,1,7.78,51688
887,4725,Ga-Rei: Zero,"Action, Super Power, Supernatural, Thriller",TV,12,7.78,145102
888,6637,Higashi no Eden Movie II: Paradise Lost,"Action, Comedy, Drama, Mystery, Romance, Thriller",Movie,1,7.78,87062
889,255,Jungle wa Itsumo Hare nochi Guu Final,"Comedy, Slice of Life",OVA,7,7.78,7576
890,10790,Kore wa Zombie Desu ka? of the Dead,"Action, Comedy, Ecchi, Harem, Magic, Supernatural",TV,10,7.78,180032
891,23385,Kyoukai no Kanata: Shinonome,"Fantasy, Slice of Life, Supernatural",Special,1,7.78,42344
893,14511,Minami-ke Tadaima,"Comedy, School, Slice of Life",TV,13,7.78,31394
894,10389,Momo e no Tegami,"Drama, Supernatural",Movie,1,7.78,30519
895,7592,Nurarihyon no Mago,"Action, Demons, Shounen, Supernatural",TV,24,7.78,122976
896,31289,One Piece: Episode of Sabo - 3 Kyoudai no Kizuna Kiseki no Saikai to Uketsugareru Ishi,"Action, Adventure, Comedy, Drama, Fantasy, Shounen, Super Power",Special,1,7.78,11922
897,32729,Orange,"Drama, Romance, School, Sci-Fi, Shoujo",TV,13,7.78,165358
898,2112,Over Drive,"Shounen, Sports",TV,26,7.78,28007
899,208,R.O.D OVA,"Action, Adventure, Historical, Magic, Mystery, Sci-Fi",OVA,3,7.78,41701
900,30296,Rakudai Kishi no Cavalry,"Action, Ecchi, Fantasy, Romance, School",TV,12,7.78,188685
901,1008,Ranma ½ Specials,"Comedy, Drama, Romance, Shounen",OVA,2,7.78,11084
902,65,Rozen Maiden: Träumend,"Action, Comedy, Drama, Magic, Seinen",TV,12,7.78,72645
903,2499,Slam Dunk: Hoero Basketman-damashii! Hanamichi to Rukawa no Atsuki Natsu,"Comedy, Drama, School, Shounen, Slice of Life, Sports",Movie,1,7.78,7856
904,3470,Special A,"Comedy, Romance, School, Shoujo",TV,24,7.78,173603
905,540,Tenchi Muyou! Ryououki 2nd Season,"Action, Comedy, Harem, Sci-Fi, Shounen, Space",OVA,6,7.78,15837
906,26,Texhnolyze,"Action, Drama, Psychological, Sci-Fi",TV,22,7.78,95859
907,1293,Urusei Yatsura,"Action, Adventure, Comedy, Drama, Romance, Sci-Fi",TV,195,7.78,23020
908,856,Utawarerumono,"Action, Drama, Fantasy, Sci-Fi",TV,26,7.78,91034
909,9201,Air Gear: Kuro no Hane to Nemuri no Mori - Break on the Sky,"Action, Comedy, Ecchi, Shounen, Sports",OVA,3,7.77,40176
910,2214,Black Jack 21,"Action, Drama",TV,17,7.77,6063
911,32108,Digimon Adventure tri. 2: Ketsui,"Action, Adventure, Comedy, Drama",Movie,1,7.77,30684
912,123,Fushigi Yuugi,"Adventure, Comedy, Drama, Fantasy, Historical, Magic, Martial Arts, Romance, Shoujo",TV,52,7.77,61622
913,488,Ichigo Mashimaro,"Comedy, Slice of Life",TV,12,7.77,46333
914,3603,JoJo no Kimyou na Bouken: Phantom Blood,"Action, Adventure, Horror, Shounen, Vampire",Movie,1,7.77,8534
915,32268,Koyomimonogatari,"Comedy, Mystery, Supernatural",ONA,12,7.77,45632
916,7270,Mobile Suit Gundam 00 Special Edition,"Action, Drama, Mecha, Military, Sci-Fi",OVA,3,7.77,7087
918,464,One Piece Movie 6: Omatsuri Danshaku to Himitsu no Shima,"Adventure, Comedy, Fantasy, Shounen",Movie,1,7.77,37792
919,9745,Sengoku Basara Movie: The Last Party,"Action, Historical, Martial Arts, Samurai, Super Power",Movie,1,7.77,18267
920,21843,Shingeki no Bahamut: Genesis,"Action, Adventure, Demons, Fantasy, Magic, Supernatural",TV,12,7.77,143701
921,539,Tenchi Muyou! Ryououki,"Action, Comedy, Sci-Fi, Shounen, Space",OVA,6,7.77,25902
922,14227,Tonari no Kaibutsu-kun,"Comedy, Romance, School, Shoujo, Slice of Life",TV,13,7.77,349836
923,11319,Zero no Tsukaima F,"Adventure, Ecchi, Fantasy, Magic, Romance",TV,12,7.77,174026
924,24151,Ao Haru Ride OVA,"Romance, School, Shoujo, Slice of Life",OVA,2,7.76,46864
925,997,Bishoujo Senshi Sailor Moon S: Kaguya Hime no Koibito,"Adventure, Comedy, Drama, Fantasy, Magic, Romance, Shoujo",Movie,1,7.76,29394
926,24913,Bokura wa Minna Kawaisou: Hajimete no,"Comedy, Romance, School, Slice of Life",Special,1,7.76,20622
927,31478,Bungou Stray Dogs,"Action, Comedy, Mystery, Seinen, Supernatural",TV,12,7.76,187805
928,28479,Detective Conan Movie 19: The Hellfire Sunflowers,"Action, Mystery, Police, Shounen",Movie,1,7.77,8600
929,2471,Doraemon (1979),"Adventure, Comedy, Fantasy, Kids, Sci-Fi, Shounen",TV,1787,7.76,14233
930,240,Genshiken,"Comedy, Parody, Slice of Life",TV,12,7.76,104258
931,1301,Ginga Tetsudou 999 (Movie),"Adventure, Drama, Fantasy, Sci-Fi, Space",Movie,1,7.76,7237
932,18619,Girls und Panzer: Kore ga Hontou no Anzio-sen Desu!,"Military, School",OVA,1,7.76,16143
933,9065,Hakuouki Hekketsuroku,"Action, Drama, Historical, Josei, Samurai, Supernatural",TV,10,7.76,49771
934,5060,Hetalia Axis Powers,"Comedy, Historical, Parody",ONA,52,7.76,144898
935,3731,Itazura na Kiss,"Comedy, Romance, Shoujo",TV,25,7.76,136279
936,1412,Lupin III,"Action, Adventure, Comedy, Shounen",TV,23,7.76,34373
937,20785,Mahouka Koukou no Rettousei,"Magic, Romance, School, Sci-Fi, Supernatural",TV,26,7.76,285317
938,2985,Majin Tantei Nougami Neuro,"Comedy, Demons, Mystery, Shounen, Supernatural",TV,25,7.76,42730
939,1483,Master Keaton,"Adventure, Mystery",TV,24,7.76,9610
940,10161,No.6,"Action, Sci-Fi",TV,11,7.76,168017
941,462,One Piece Movie 4: Dead End no Bouken,"Action, Adventure, Comedy, Fantasy, Shounen, Super Power",Movie,1,7.76,39946
942,5507,Senjou no Valkyria,"Action, Military, Romance",TV,26,7.76,77591
943,6444,Tegamibachi,"Adventure, Fantasy, Shounen, Supernatural",TV,25,7.76,70987
944,10715,Towa no Quon 4: Guren no Shoushin,"Action, Super Power, Supernatural",Movie,1,7.76,18545
945,95,Turn A Gundam,"Action, Adventure, Drama, Mecha, Military, Sci-Fi, Space",TV,50,7.76,20056
946,8247,Bleach Movie 4: Jigoku-hen,"Action, Comedy, Shounen, Super Power, Supernatural",Movie,1,7.75,94074
947,20031,D-Frag!,"Comedy, Game, School, Seinen",TV,12,7.75,154548
949,986,Dragon Ball Z Special 1: Tatta Hitori no Saishuu Kessen,"Adventure, Comedy, Fantasy, Sci-Fi, Shounen",Special,1,7.75,46276
950,28669,Go! Princess Precure,"Action, Comedy, Fantasy, Magic, School, Shoujo, Slice of Life",TV,50,7.74,5098
951,2026,Hayate no Gotoku!,"Action, Comedy, Harem, Parody, Romance",TV,52,7.75,130085
952,450,InuYasha: Kagami no Naka no Mugenjo,"Adventure, Demons, Drama, Fantasy, Historical, Romance, Shounen, Supernatural",Movie,1,7.75,54854
953,32491,Kanojo to Kanojo no Neko: Everything Flows,"Psychological, Romance, Slice of Life",TV,4,7.75,38765
954,6624,Kara no Kyoukai Remix: Gate of Seventh Heaven,"Action, Mystery, Romance, Super Power, Thriller",Movie,1,7.75,24735
955,3466,Kino no Tabi: The Beautiful World - Tou no Kuni,"Adventure, Fantasy, Psychological",Special,1,7.75,19211
956,15439,"Kono Danshi, Ningyo Hiroimashita.","Fantasy, Shounen Ai",OVA,1,7.75,14775
957,19669,Kuroko no Basket: Baka ja Katenai no yo!,"Comedy, School, Shounen, Sports",OVA,1,7.75,26785
958,25015,Kyoukai no Kanata Movie: I&#039;ll Be Here - Kako-hen,"Action, Fantasy, Supernatural",Movie,1,7.75,42304
960,33338,One Piece: Heart of Gold,"Action, Adventure, Comedy, Drama, Fantasy, Shounen",Special,1,7.75,17443
961,23777,Shingeki no Kyojin Movie 2: Jiyuu no Tsubasa,"Action, Drama, Fantasy, Shounen, Super Power",Movie,1,7.75,26958
962,10278,The iDOLM@STER,"Comedy, Drama, Music",TV,25,7.75,81155
964,1830,Utawarerumono Specials,"Action, Comedy, Drama, Fantasy",Special,6,7.75,11149
965,24405,World Trigger,"Action, School, Sci-Fi, Shounen, Supernatural",TV,73,7.75,106872
967,740,Bishoujo Senshi Sailor Moon R,"Demons, Magic, Romance, Shoujo",TV,43,7.74,73305
968,2213,Black Jack (TV),Drama,TV,61,7.74,15552
969,371,Cardcaptor Sakura Movie 1,"Comedy, Drama, Fantasy, Magic, Shoujo",Movie,1,7.74,56327
971,430,Fullmetal Alchemist: The Conqueror of Shamballa,"Comedy, Drama, Fantasy, Historical, Military, Shounen",Movie,1,7.74,186465
972,1813,Genshiken OVA,"Comedy, Parody, Slice of Life",OVA,3,7.74,35493
973,16528,Hal,"Romance, Sci-Fi, Shoujo",Movie,1,7.74,50812
975,6372,Higashi no Eden Movie I: The King of Eden,"Comedy, Drama, Mystery, Romance, Slice of Life, Thriller",Movie,1,7.74,101734
976,17,Hungry Heart: Wild Striker,"Comedy, Shounen, Slice of Life, Sports",TV,52,7.74,13469
977,3931,Initial D Battle Stage 2,"Action, Cars, Drama, Seinen, Sports",OVA,1,7.74,11015
978,24439,Kekkai Sensen,"Action, Fantasy, Shounen, Super Power, Supernatural, Vampire",TV,12,7.74,220573
979,23441,Love Stage!! OVA,"Comedy, Romance, Shounen Ai",OVA,1,7.74,23631
980,1915,Mahou Shoujo Lyrical Nanoha StrikerS,"Action, Comedy, Drama, Magic, Super Power",TV,26,7.74,35442
981,323,Mousou Dairinin,"Drama, Mystery, Police, Psychological, Supernatural, Thriller",TV,13,7.74,137687
983,584,Noein: Mou Hitori no Kimi e,"Adventure, Drama, Sci-Fi, Slice of Life",TV,24,7.74,56244
984,24543,Persona 3 the Movie 3: Falling Down,"Action, Fantasy, Seinen, Supernatural",Movie,1,7.74,19928
985,6634,Sengoku Basara Two,"Action, Historical, Martial Arts, Samurai, Super Power",TV,12,7.74,42798
986,355,Shakugan no Shana,"Action, Drama, Fantasy, Romance, School, Supernatural",TV,24,7.74,297058
987,30549,Soukyuu no Fafner: Dead Aggressor - Exodus 2nd Season,"Action, Drama, Mecha, Military, Sci-Fi",TV,13,7.74,6787
988,1279,Taiyou no Ko Esteban,"Adventure, Historical, Sci-Fi",TV,39,7.74,5424
989,10033,Toriko,"Action, Adventure, Comedy, Fantasy, Shounen",TV,147,7.74,54790
990,11531,UN-GO: Inga-ron,"Mystery, Supernatural",Movie,1,7.74,23340
991,966,Crayon Shin-chan,"Comedy, Ecchi, Kids, School, Shounen, Slice of Life",TV,0,7.73,26267
992,25341,Diamond no Ace OVA,"Comedy, School, Shounen, Sports",OVA,3,7.72,7376
994,32979,Flip Flappers,"Comedy, Sci-Fi",TV,13,7.73,40945
995,132,GetBackers,"Action, Comedy, Drama, Mystery, Shounen, Super Power, Supernatural",TV,49,7.73,73536
996,14467,K,"Action, Super Power, Supernatural",TV,13,7.73,297051
997,8532,Katekyo Hitman Reborn! Special,"Comedy, Shounen",ONA,1,7.73,19991
998,1606,Kekkaishi,"Adventure, Comedy, Fantasy, Shounen",TV,52,7.73,61884
999,9136,Kuroshitsuji II Specials,"Comedy, Fantasy, Parody, Shounen, Supernatural",Special,6,7.73,60899
1001,7627,Mitsudomoe,"Comedy, School, Slice of Life",TV,13,7.73,56483
1002,32485,Prison School OVA,"Comedy, Ecchi, Romance, School, Seinen",OVA,1,7.73,30887
1003,6773,Shakugan no Shana III (Final),"Action, Drama, Fantasy, Romance, Supernatural",TV,24,7.73,133010
1004,1650,Uchuu Senkan Yamato,"Action, Adventure, Drama, Military, Sci-Fi, Space",TV,26,7.73,10688
1006,1840,Zero no Tsukaima: Futatsuki no Kishi,"Action, Adventure, Comedy, Ecchi, Fantasy, Harem, Magic, Romance, School",TV,12,7.73,235684
1007,33513,Ansatsu Kyoushitsu: 365-nichi no Jikan,"Action, Comedy, School, Shounen",Movie,1,7.72,14896
1008,2724,Daicon Opening Animations,"Action, Adventure, Mecha, Music, Sci-Fi",Special,2,7.72,7174
1009,905,Dragon Ball Z Movie 12: Fukkatsu no Fusion!! Gokuu to Vegeta,"Adventure, Comedy, Fantasy, Sci-Fi, Shounen",Movie,1,7.72,56994
1010,32915,Durarara!!x2 Ketsu: Dufufufu!!,"Action, Mystery, Supernatural",Special,1,7.72,13126
1013,5231,Inazuma Eleven,"Shounen, Sports, Super Power",TV,127,7.72,42677
1014,5204,Kara no Kyoukai 6: Boukyaku Rokuon,"Action, Magic, Mystery, Romance, Supernatural, Thriller",Movie,1,7.72,93803
1015,12487,Kyoukaisenjou no Horizon II,"Action, Fantasy, Sci-Fi",TV,13,7.72,46781
1016,324,Mobile Police Patlabor: On Television,"Comedy, Mecha, Police, Sci-Fi",TV,47,7.72,16130
1017,709,Mujin Wakusei Survive,"Action, Adventure, Fantasy, Sci-Fi, Slice of Life",TV,52,7.72,11684
1018,21755,New Prince of Tennis OVA vs. Genius10,"Action, Comedy, Shounen, Sports",OVA,10,7.72,6238
1019,32668,Noblesse: Awakening,"Action, School, Supernatural, Vampire",ONA,1,7.72,28864
1020,1034,Ouritsu Uchuugun: Honneamise no Tsubasa,"Action, Drama, Military, Sci-Fi, Space",Movie,1,7.72,18469
1021,33157,Tanaka-kun wa Itsumo Kedaruge Specials,"Comedy, School, Slice of Life",Special,0,7.72,5400
1022,23701,Toradora! OVA,"Comedy, Romance, School, Slice of Life",OVA,1,7.72,25154
1023,10716,Towa no Quon 5: Souzetsu no Raifuku,"Action, Super Power, Supernatural",Movie,1,7.72,18060
1026,3090,Aa! Megami-sama!: Tatakau Tsubasa,"Comedy, Magic, Romance, Seinen, Supernatural",Special,2,7.71,18465
1027,7647,Arakawa Under the Bridge,"Comedy, Romance, Seinen",TV,13,7.71,162622
1028,530,Bishoujo Senshi Sailor Moon,"Demons, Magic, Romance, Shoujo",TV,46,7.71,146521
1029,3785,Evangelion: 3.0 You Can (Not) Redo,"Action, Mecha, Sci-Fi",Movie,1,7.71,135318
1030,7902,Fullmetal Alchemist: Brotherhood - 4-Koma Theater,"Comedy, Fantasy, Military, Parody",Special,16,7.71,31262
1031,1281,Gakkou no Kaidan,"Horror, Mystery, Supernatural",TV,19,7.71,42033
1032,24765,Gakkougurashi!,"Horror, Mystery, Psychological, School, Slice of Life",TV,12,7.71,140094
1033,129,Gensoumaden Saiyuuki,"Adventure, Comedy, Drama, Shounen, Supernatural",TV,50,7.71,31179
1034,7661,Giant Killing,"Drama, Seinen, Sports",TV,26,7.71,36947
1036,24703,High School DxD BorN,"Action, Comedy, Demons, Ecchi, Harem, Romance, School",TV,12,7.71,192171
1039,16762,Mirai Nikki Redial,"Action, Psychological, Shounen, Supernatural",OVA,1,7.71,135604
1040,18849,Natsume Yuujinchou: Nyanko-sensei to Hajimete no Otsukai,"Drama, Fantasy, Shoujo, Slice of Life, Supernatural",Special,1,7.71,14703
1041,10500,Ojiisan no Lamp,"Drama, Historical",Movie,1,7.71,11745
1042,14123,Pokemon Black and White 2: Introduction Movie,"Action, Fantasy, Kids",ONA,1,7.71,8554
1043,10573,Prince of Tennis: Another Story II - Ano Toki no Bokura,"Shounen, Sports",OVA,4,7.71,6005
1044,8675,Seitokai Yakuindomo,"Comedy, School, Shounen, Slice of Life",TV,13,7.71,217617
1045,1557,Shounen Onmyouji,"Action, Demons, Fantasy, Historical, Magic, Shoujo, Supernatural",TV,26,7.71,33321
1046,14289,Sukitte Ii na yo.,"Romance, School, Shoujo",TV,13,7.71,233410
1047,11743,Toaru Majutsu no Index: Endymion no Kiseki,"Action, Magic, Sci-Fi, Super Power",Movie,1,7.71,54873
1048,30458,Tokyo Ghoul: &quot;Jack&quot;,"Action, Drama, Horror, School, Seinen, Supernatural",OVA,1,7.71,70635
1049,29854,Ushio to Tora (TV),"Action, Adventure, Comedy, Demons, Shounen, Supernatural",TV,26,7.71,90931
1050,11433,Ano Natsu de Matteru,"Comedy, Drama, Romance, Sci-Fi, Slice of Life",TV,12,7.7,169718
1051,31821,Arslan Senki (TV): Fuujin Ranbu,"Action, Adventure, Drama, Fantasy, Historical, Shounen, Supernatural",TV,8,7.7,53577
1052,14967,Boku wa Tomodachi ga Sukunai Next,"Comedy, Harem, Romance, School, Seinen, Slice of Life",TV,12,7.7,214319
1053,12049,Fairy Tail Movie 1: Houou no Miko,"Action, Adventure, Comedy, Fantasy, Magic, Shounen",Movie,1,7.7,77560
1054,6152,Final Fantasy VII: Advent Children - Venice Film Festival Footage,"Action, Drama, Fantasy, Sci-Fi",Movie,1,7.7,6498
1056,19191,Ghost in the Shell: Arise - Border:2 Ghost Whispers,"Mecha, Police, Psychological, Sci-Fi",Movie,1,7.7,24880
1057,11617,High School DxD,"Comedy, Demons, Ecchi, Harem, Romance, School",TV,12,7.7,398660
1059,914,Ike! Ina-chuu Takkyuubu,"Comedy, Ecchi, School, Sports",TV,26,7.7,7988
1060,24781,Imawa no Kuni no Alice (OVA),"Action, Psychological, Shounen, Supernatural, Thriller",OVA,3,7.7,18351
1061,21327,Isshuukan Friends.,"Comedy, School, Shounen, Slice of Life",TV,12,7.7,139601
1062,10568,Kamisama no Memochou,Mystery,TV,12,7.7,130502
1063,1087,Kimagure Orange☆Road,"Comedy, Drama, Romance, School, Shounen, Slice of Life, Super Power",TV,48,7.7,16012
1065,15051,Love Live! School Idol Project,"Music, School, Slice of Life",TV,13,7.7,155281
1066,11933,Oda Nobuna no Yabou,"Comedy, Historical, Romance",TV,12,7.7,133216
1067,23301,Pokemon XY: Mega Evolution,"Action, Adventure, Comedy, Fantasy, Kids",Special,4,7.7,10227
1068,5493,Ranma ½: Akumu! Shunmin Kou,"Action, Comedy, Martial Arts, Shounen, Supernatural",OVA,1,7.7,7064
1069,23775,Shingeki no Kyojin Movie 1: Guren no Yumiya,"Action, Drama, Fantasy, Shounen, Super Power",Movie,1,7.7,31990
1070,9751,Strike Witches Movie,"Action, Ecchi, Magic, Military, Sci-Fi",Movie,1,7.7,23856
1071,969,Tsubasa Chronicle 2nd Season,"Action, Adventure, Drama, Fantasy, Mystery, Romance, Shounen, Supernatural",TV,26,7.7,79166
1072,32681,Uchuu Patrol Luluco,"Action, Adventure, Comedy, Space",TV,13,7.7,50236
1074,7762,"Yondemasu yo, Azazel-san.","Comedy, Demons, Supernatural",OVA,4,7.7,18400
1075,10495,Yuru Yuri,"Comedy, School, Shoujo Ai, Slice of Life",TV,12,7.7,148140
1076,880,Aa! Megami-sama!: Sorezore no Tsubasa,"Comedy, Magic, Romance, Seinen, Supernatural",TV,22,7.69,42026
1077,15061,Aikatsu!,"Music, School, Shoujo, Slice of Life",TV,178,7.69,16990
1078,857,Air Gear,"Action, Comedy, Ecchi, Shounen, Sports",TV,25,7.69,194611
1079,110,Chuuka Ichiban!,"Action, Comedy, Drama, Shounen",TV,52,7.69,8586
1080,23251,Gugure! Kokkuri-san,"Comedy, Shounen, Supernatural",TV,12,7.69,87824
1081,587,Hanbun no Tsuki ga Noboru Sora,"Comedy, Drama, Romance",TV,6,7.69,65125
1083,11013,Inu x Boku SS,"Comedy, Romance, Shounen, Supernatural",TV,12,7.69,216204
1084,452,InuYasha: Toki wo Koeru Omoi,"Adventure, Comedy, Demons, Drama, Fantasy, Historical, Romance, Shounen, Super Power",Movie,1,7.69,51354
1085,1579,Kiniro no Corda: Primo Passo,"Comedy, Drama, Harem, Magic, Music, Romance, School, Shoujo",TV,25,7.69,63134
1086,32869,Kuroko no Basket Movie 1: Winter Cup Soushuuhen - Kage to Hikari,"School, Shounen, Sports",Movie,1,7.69,7573
1087,6793,Kuroshitsuji Special,"Comedy, Demons, Parody",Special,1,7.69,53706
1088,6172,Layton Kyouju to Eien no Utahime,Mystery,Movie,1,7.69,12867
1089,21105,Love Stage!!,"Comedy, Romance, Shounen Ai",TV,10,7.69,83397
1090,194,Macross Zero,"Adventure, Mecha, Military, Sci-Fi, Shounen",OVA,5,7.69,23568
1091,3001,Moyashimon,"Comedy, School, Supernatural",TV,11,7.69,44465
1092,8190,Nodame Cantabile OVA 2,"Comedy, Josei, Romance",OVA,1,7.69,17226
1093,23277,Saenai Heroine no Sodatekata,"Comedy, Ecchi, Harem, Romance, School",TV,12,7.69,155795
1094,2498,Slam Dunk: Shouhoku Saidai no Kiki! Moero Sakuragi Hanamichi,"Comedy, Drama, School, Shounen, Slice of Life, Sports",Movie,1,7.69,7834
1096,4654,Toaru Majutsu no Index,"Action, Magic, Sci-Fi, Super Power",TV,24,7.69,313114
1097,18139,Tonari no Seki-kun,"Comedy, School, Seinen",TV,21,7.69,82568
1098,16005,Zettai Karen Children: The Unlimited - Hyoubu Kyousuke,"Shounen, Supernatural",TV,12,7.69,61919
1099,32015,Ajin OVA,"Action, Horror, Mystery, Seinen, Supernatural",OVA,3,7.68,15613
1100,22147,Amagi Brilliant Park,"Comedy, Magic",TV,13,7.68,217003
1101,1946,Ashita no Nadja,"Adventure, Drama, Historical, Romance, Shoujo",TV,50,7.68,13742
1102,67,Basilisk: Kouga Ninpou Chou,"Action, Adventure, Fantasy, Historical, Romance, Samurai, Supernatural",TV,24,7.68,98144
1103,32365,Boruto: Naruto the Movie - Naruto ga Hokage ni Natta Hi,"Action, Comedy, Martial Arts, Shounen, Super Power",Special,1,7.68,16868
1104,14345,Btooom!,"Action, Psychological, Sci-Fi, Seinen",TV,12,7.68,329561
1105,11359,Dragon Ball Kai: Mirai ni Heiwa wo! Goku no Tamashii yo Eien ni,"Action, Comedy, Fantasy, Sci-Fi, Shounen, Super Power",Special,1,7.68,17166
1106,428,Kaleido Star: Aratanaru Tsubasa - Extra Stage,"Adventure, Comedy, Drama, Shoujo",OVA,1,7.68,9248
1107,4188,Mahou Sensei Negima! Shiroki Tsubasa Ala Alba,"Adventure, Comedy, Ecchi, Harem, Magic, Romance, Shounen, Supernatural, Vampire",OVA,3,7.68,15616
1108,340,Mutsu Enmei Ryuu Gaiden: Shura no Toki,"Action, Historical, Martial Arts, Samurai, Shounen",TV,26,7.68,13959
1109,10588,Persona 4 the Animation,"Adventure, Mystery, School, Sci-Fi, Super Power, Supernatural",TV,25,7.68,134942
1110,5958,Sora no Otoshimono,"Comedy, Ecchi, Harem, Romance, Sci-Fi, Shounen, Supernatural",TV,13,7.68,227681
1111,14669,Aura: Maryuuin Kouga Saigo no Tatakai,"Comedy, Drama, Romance, School, Supernatural",Movie,1,7.67,22599
1113,8331,Detective Conan Magic File 4: Osaka Okonomiyaki Odyssey,"Comedy, Mystery, Police, Shounen",OVA,1,7.67,6460
1114,455,Fantastic Children,"Adventure, Fantasy, Mystery, Romance, Sci-Fi",TV,26,7.67,17773
1115,18507,Free!,"Comedy, School, Slice of Life, Sports",TV,12,7.67,265791
1116,27411,Ghost in the Shell (2015),"Action, Mecha, Police, Psychological, Sci-Fi",Movie,1,7.67,19872
1117,17729,Grisaia no Kajitsu,"Drama, Harem, Psychological, Romance, School",TV,13,7.67,178166
1118,26023,Haiyore! Nyaruko-san F,"Comedy, Parody, Romance, Sci-Fi",OVA,1,7.67,19620
1121,617,Juubee Ninpuuchou,"Adventure, Fantasy, Historical, Horror, Romance, Shounen, Supernatural",Movie,1,7.67,55697
1122,31798,Kiznaiver,"Drama, Sci-Fi",TV,12,7.67,197912
1123,8841,Kore wa Zombie Desu ka?,"Action, Comedy, Ecchi, Harem, Magic, Supernatural",TV,12,7.67,295782
1124,9396,Mitsudomoe Special,"Comedy, School, Slice of Life",Special,1,7.67,11354
1125,11371,New Prince of Tennis,"Action, Comedy, Shounen, Sports",TV,13,7.67,30630
1126,32542,Sakamoto desu ga?,"Comedy, School, Seinen",TV,12,7.67,171452
1127,5306,Tales of Symphonia The Animation: Tethe&#039;alla-hen,"Action, Adventure, Fantasy, Magic, Martial Arts, Shounen",OVA,4,7.67,20355
1128,2268,Tatakae! Chou Robot Seimeitai Transformers,"Adventure, Mecha, Sci-Fi, Shounen",TV,98,7.67,5652
1129,177,Tsubasa Chronicle,"Action, Adventure, Fantasy, Magic, Romance, Shounen, Supernatural",TV,26,7.67,134705
1130,22729,Aldnoah.Zero,"Action, Mecha, Sci-Fi",TV,12,7.66,244193
1131,4835,Bleach Movie 3: Fade to Black - Kimi no Na wo Yobu,"Action, Comedy, Shounen, Super Power, Supernatural",Movie,1,7.66,122373
1132,8888,Code Geass: Boukoku no Akito 1 - Yokuryuu wa Maiorita,"Action, Mecha, Military, Sci-Fi",Movie,1,7.66,91105
1133,5348,Detective Conan Magic File 2: Kudou Shinichi - The Case of the Mysterious Wall and the Black Lab,"Adventure, Comedy, Mystery, Police, Shounen",OVA,1,7.66,7726
