,anime_id,name,genre,type,episodes,rating,members
1815,1441,Ginga Tetsudou no Yoru,"Drama, Fantasy, Historical, Kids, Mystery",Movie,1,7.43,7755
1816,15699,Haiyore! Nyaruko-san W,"Comedy, Parody, Sci-Fi",TV,12,7.43,84442
1817,30991,Himouto! Umaru-chan: Umaru-chan Mou Ikkai!,"Comedy, School, Seinen, Slice of Life",OVA,1,7.43,21413
1818,14753,Hori-san to Miyamura-kun,"Comedy, Romance, School, Shounen",OVA,3,7.43,26535
1819,13469,Hyouka: Motsubeki Mono wa,Slice of Life,OVA,1,7.43,68823
1820,18295,Kakumeiki Valvrave 2nd Season,"Action, Mecha, Space",TV,12,7.43,57434
1821,3958,Kannagi,"Comedy, School, Shounen, Supernatural",TV,13,7.43,94202
1822,32574,Kekkai Sensen: Ousama no Restaurant no Ousama,"Action, Fantasy, Shounen, Super Power, Supernatural, Vampire",OVA,1,7.43,9335
1823,845,Kiba,"Adventure, Fantasy, Shounen",TV,51,7.43,47651
1825,1090,Mobile Suit Gundam I,"Action, Adventure, Drama, Mecha, Military, Sci-Fi, Space",Movie,1,7.43,12877
1826,1722,Nagasarete Airantou,"Comedy, Ecchi, Fantasy, Harem, Romance",TV,26,7.43,52817
1827,2472,Naruto: Shippuuden Movie 1,"Action, Adventure, Comedy, Fantasy, Shounen",Movie,1,7.43,108170
1828,4437,Naruto: Shippuuden Movie 2 - Kizuna,"Action, Martial Arts, Shounen, Supernatural",Movie,1,7.43,97818
1829,1237,One Piece: Oounabara ni Hirake! Dekkai Dekkai Chichi no Yume!,"Action, Adventure, Comedy, Fantasy, Shounen, Super Power",Special,1,7.43,17175
1830,13659,Ore no Imouto ga Konnani Kawaii Wake ga Nai.,"Comedy, Seinen, Slice of Life",TV,13,7.43,194791
1832,108,Ou Dorobou Jing in Seventh Heaven,"Adventure, Comedy, Fantasy, Psychological, Shounen",OVA,3,7.43,8561
1833,161,Peace Maker Kurogane,"Action, Comedy, Historical, Samurai, Shounen",TV,24,7.43,35123
1834,527,Pokemon,"Action, Adventure, Comedy, Fantasy, Kids",TV,276,7.43,229157
1835,2182,Robot Carnival,"Fantasy, Sci-Fi",OVA,1,7.43,7213
1836,13599,Robotics;Notes,"Drama, Mystery, School, Sci-Fi",TV,22,7.43,107304
1837,4664,Rurouni Kenshin: Special Techniques,"Action, Comedy, Samurai",Special,1,7.43,6677
1838,32175,Shounen Maid,"Comedy, Shoujo, Slice of Life",TV,12,7.43,30363
1839,1171,Slayers Excellent,"Adventure, Comedy, Demons, Fantasy, Magic, Shounen, Supernatural",OVA,3,7.43,13842
1840,6381,Strike Witches 2,"Action, Ecchi, Magic, Military, Sci-Fi",TV,12,7.43,51114
1841,11793,"Tamayura: Hitotose - Attakai Kaze no Omoide, Nanode","Comedy, Drama, Slice of Life",Special,1,7.44,5533
1845,25157,Trinity Seven,"Action, Comedy, Ecchi, Fantasy, Harem, Magic, Romance, School, Shounen, Supernatural",TV,12,7.43,208796
1847,7058,Uragiri wa Boku no Namae wo Shitteiru,"Adventure, Drama, Fantasy, Shoujo, Shounen Ai",TV,24,7.43,55040
1848,28405,Ansatsu Kyoushitsu (TV): Deai no Jikan,"Action, Comedy, School, Shounen",Special,1,7.42,29382
1849,9544,Biohazard: Damnation,"Action, Horror, Sci-Fi",Movie,1,7.42,10737
1851,2756,Cheonnyeon-yeowoo Yeowoobi,"Drama, Fantasy, Sci-Fi",Movie,1,7.42,9045
1852,5065,Detroit Metal City: Birth of the Metal Devil,"Comedy, Music, Parody, Romance",Special,1,7.42,16101
1853,10444,Digimon Xros Wars: Aku no Death General to Nanatsu no Oukoku,"Action, Adventure, Comedy, Fantasy, Shounen",TV,24,7.42,12505
1858,21681,Hanayamata,"Comedy, School, Seinen, Slice of Life",TV,12,7.42,55536
1859,1030,Heisei Tanuki Gassen Ponpoko,Kids,Movie,1,7.42,34263
1860,31989,Hibike! Euphonium Movie: Kitauji Koukou Suisougaku-bu e Youkoso,"Music, School",Movie,1,7.42,8349
1861,3859,Himitsu: The Revelation,"Mystery, Police, Psychological, Sci-Fi, Shoujo",TV,26,7.42,11761
1862,10804,Ikoku Meiro no Croisée Special,"Historical, Seinen, Slice of Life",Special,1,7.42,5950
1863,10805,Kami nomi zo Shiru Sekai: 4-nin to Idol,"Comedy, Music, Shounen, Supernatural",OVA,1,7.42,57797
1864,10536,Kimi ni Todoke 2nd Season Specials,"Comedy, Romance, Shoujo",Special,3,7.42,23498
1865,22817,Kindaichi Shounen no Jikenbo Returns,"Mystery, Shounen",TV,25,7.42,8128
1866,17259,Kuroko no Basket: Oshaberi Shiyokka,"Comedy, School, Shounen, Sports",Special,1,7.42,23937
1867,335,Matantei Loki Ragnarok,"Comedy, Magic, Mystery, Shounen, Supernatural",TV,26,7.42,25098
1868,738,MÄR,"Action, Adventure, Comedy, Fantasy, Shounen",TV,102,7.42,28968
1869,2294,Mobile Suit Gundam Seed Destiny Special Edition,"Action, Drama, Mecha, Military, Romance, Sci-Fi, Space",Special,4,7.42,7799
1870,443,Onegai☆Teacher: Himitsu na Futari,"Comedy, Ecchi, Romance, Sci-Fi",OVA,1,7.42,32134
1871,20939,"Ore no Nounai Sentakushi ga, Gakuen Love Comedy wo Zenryoku de Jama Shiteiru OVA","Comedy, Romance, School",OVA,1,7.42,35583
1872,12753,Phi Brain: Kami no Puzzle - Orpheus Order-hen,"Action, Game, Mystery, Shounen",TV,25,7.42,29878
1873,15651,Phi Brain: Kami no Puzzle - Shukuteki! Rätsel-hen,"Action, Game, Mystery, Shounen",TV,25,7.42,20424
1874,1255,Saint Seiya: Shinku no Shounen Densetsu,"Adventure, Fantasy, Sci-Fi, Shounen",Movie,1,7.42,8849
1875,1259,Saint Seiya: Tenkai-hen Josou - Overture,"Adventure, Sci-Fi, Shounen",Movie,1,7.42,11705
1877,867,Slayers Gorgeous,"Adventure, Comedy, Fantasy, Magic, Supernatural",Movie,1,7.42,12755
1878,869,Slayers Return,"Adventure, Comedy, Fantasy, Magic, Shounen",Movie,1,7.42,12909
1880,5141,Taishou Yakyuu Musume.,"Comedy, Historical, School, Seinen, Sports",TV,12,7.42,12248
1881,2683,Tokyo Majin Gakuen Kenpucho: Tou Dai Ni Maku,"Action, Drama, Fantasy, Horror, Martial Arts, Mystery, School",TV,12,7.42,21972
1883,5764,Zero no Tsukaima: Princesses no Rondo - Yuuwaku no Sunahama,"Comedy, Ecchi, Fantasy, Harem, Magic",Special,1,7.42,51816
1884,5525,07-Ghost,"Action, Demons, Fantasy, Magic, Military, Shoujo",TV,25,7.41,126083
1885,49,Aa! Megami-sama!,"Comedy, Magic, Romance, Seinen, Supernatural",OVA,5,7.41,34590
1886,1292,Afro Samurai,"Action, Adventure, Samurai",TV,5,7.41,135708
1887,3549,Allison to Lillia,"Action, Adventure, Shounen",TV,26,7.41,27571
1890,10638,Denpa Onna to Seishun Otoko Special,"Comedy, Sci-Fi, Seinen",Special,1,7.41,34723
1893,12875,Ginga e Kickoff!!,"Shounen, Sports",TV,39,7.41,11907
1894,287,Grappler Baki (TV),"Shounen, Sports",TV,24,7.41,23220
1895,20689,Hamatora The Animation,"Comedy, Mystery, Super Power",TV,12,7.41,133571
1896,27829,Heavy Object,"Action, Mecha, Military, Sci-Fi",TV,24,7.41,68382
1897,1410,IGPX: Immortal Grand Prix (2005) 2nd Season,"Mecha, Sci-Fi, Shounen, Sports",TV,13,7.41,6863
1898,953,Jyu Oh Sei,"Action, Adventure, Drama, Mystery, Sci-Fi, Shoujo",TV,11,7.41,44766
1899,10298,Kaichou wa Maid-sama!: Goshujinsama to Asonjao♥,"Comedy, School, Shoujo",Special,1,7.41,41241
1900,147,Kimi ga Nozomu Eien,"Drama, Romance, Slice of Life",TV,14,7.41,90379
1901,16732,Kiniro Mosaic,"Comedy, School, Slice of Life",TV,12,7.41,78131
1905,3225,Minami-ke Okawari,"Comedy, School, Slice of Life",TV,13,7.41,50837
1906,6288,Mobile Suit Gundam 00 The Movie: A Wakening of the Trailblazer,"Action, Mecha, Sci-Fi, Space",Movie,1,7.41,37069
1907,2926,Myself; Yourself,"Drama, Romance, School",TV,13,7.41,115075
1908,272,Noir,"Action, Drama, Mystery",TV,26,7.41,66036
1910,326,Petshop of Horrors,"Horror, Josei, Mystery, Supernatural",TV,4,7.41,32696
1911,10711,Plastic Neesan,"Comedy, School",ONA,12,7.41,83977
1912,2744,Potemayo,"Comedy, School, Seinen",TV,12,7.41,11411
1916,22273,Selector Infected WIXOSS,"Game, Psychological",TV,12,7.41,80964
1917,868,Slayers Great,"Adventure, Comedy, Fantasy, Magic, Shounen",Movie,1,7.41,12760
1918,5226,Souten Kouro,"Action, Adventure, Historical",TV,26,7.41,9852
1920,541,Tenchi Muyou! Ryououki 3rd Season,"Action, Comedy, Harem, Sci-Fi, Shounen, Space",OVA,6,7.41,12242
1922,10834,Baka to Test to Shoukanjuu: Spinout! Sore ga Bokura no Nichijou,"Comedy, Romance, School, Super Power",Special,6,7.4,19758
1923,5356,Canaan,"Action, Seinen",TV,13,7.4,123217
1924,15611,Cardfight!! Vanguard: Link Joker-hen,"Action, Adventure, Demons, Game, Shounen",TV,59,7.4,9075
1925,20479,Choujigen Game Neptune The Animation OVA,"Action, Comedy, Fantasy, Sci-Fi",OVA,1,7.4,16067
1927,2398,Digimon Adventure 02: Diablomon no Gyakushuu,"Adventure, Comedy, Drama, Kids, Sci-Fi",Movie,1,7.4,31961
1930,30694,Dragon Ball Super,"Action, Adventure, Comedy, Fantasy, Martial Arts, Shounen, Super Power",TV,0,7.4,111443
1931,12231,Dragon Ball: Episode of Bardock,"Action, Adventure, Comedy, Fantasy, Martial Arts, Sci-Fi, Shounen, Super Power",Special,1,7.4,29030
1934,940,Inukami!,"Comedy, Ecchi, Romance, Shounen, Supernatural",TV,26,7.4,47882
1935,2808,Irregular Hunter X: The Day of Sigma,"Action, Mecha, Sci-Fi, Shounen",OVA,1,7.4,6348
1936,4483,Mahoutsukai ni Taisetsu na Koto: Natsu no Sora,"Drama, Magic, Shounen, Slice of Life",TV,12,7.4,14911
1937,99,Mai-Otome,"Comedy, Drama, Fantasy, Magic",TV,26,7.4,36924
1938,1196,Masuda Kousuke Gekijou Gag Manga Biyori,"Comedy, Parody",TV,12,7.4,5423
1939,16444,Mondaiji-tachi ga Isekai kara Kuru Sou Desu yo?: Onsen Manyuuki,"Fantasy, Supernatural",OVA,1,7.4,44450
1941,5597,Natsu no Arashi!,"Comedy, Romance, Supernatural",TV,13,7.4,30098
1942,12467,Nazo no Kanojo X,"Ecchi, Romance, School, Seinen",TV,13,7.4,99788
1943,10928,Nogizaka Haruka no Himitsu: Finale,"Comedy, Romance",OVA,4,7.4,20660
1945,1526,Pokemon Advanced Generation: Mew to Hadou no Yuusha Lucario,"Action, Adventure, Drama, Fantasy, Kids",Movie,1,7.4,46887
1948,15963,Seitokai no Ichizon Lv.2: Watasu Seitokai,"Comedy, Harem, Parody, School",OVA,1,7.4,11554
1949,4063,Sekirei,"Action, Comedy, Ecchi, Harem, Super Power",TV,12,7.4,182713
1950,9355,Sekirei: Pure Engagement - Kanwa ni Dai,"Comedy, Ecchi, Harem",Special,1,7.4,26719
1951,9793,Senjou no Valkyria 3: Tagatame no Juusou,"Action, Fantasy, Military",OVA,2,7.4,9847
1952,6380,Tetsuwan Birdy Decode: The Cipher,"Action, Comedy, Sci-Fi",OVA,1,7.4,12944
1953,3089,The Sky Crawlers,"Drama, Military",Movie,1,7.4,32660
1954,944,The Third: Aoi Hitomi no Shoujo,"Action, Adventure, Sci-Fi, Seinen",TV,24,7.4,14304
1955,3457,Vampire Knight,"Drama, Mystery, Romance, Shoujo, Supernatural, Vampire",TV,13,7.4,286826
1956,935,Witchblade,"Action, Sci-Fi, Super Power",TV,24,7.4,64697
1957,14951,Wonderful Rush,Music,Music,1,7.4,6807
1958,92,After War Gundam X,"Adventure, Drama, Mecha, Sci-Fi, Space",TV,39,7.39,19132
1959,713,Air Movie,"Drama, Romance, Supernatural",Movie,1,7.39,44179
1965,4726,Druaga no Tou: The Sword of Uruk,"Adventure, Fantasy",TV,12,7.39,46237
1966,27525,Fate/kaleid liner Prisma☆Illya 2wei Herz!,"Action, Comedy, Fantasy, Magic, Slice of Life",TV,10,7.39,42499
1967,664,Fullmetal Alchemist: Reflections,"Adventure, Comedy, Drama, Fantasy, Military, Shounen",Special,1,7.39,24987
1968,3508,Genius Party,"Action, Dementia, Fantasy, Mecha, Music, Psychological, Romance, Sci-Fi",Movie,7,7.39,18612
1969,6795,Genius Party Beyond,"Dementia, Fantasy, Music, Sci-Fi",Movie,5,7.39,10660
1974,13271,Hunter x Hunter Movie: Phantom Rouge,"Action, Adventure, Shounen, Super Power",Movie,1,7.39,44589
1975,6980,Kaidan Restaurant,"Horror, Kids, Mystery, Supernatural",TV,23,7.39,9994
1976,28623,Koutetsujou no Kabaneri,"Action, Drama, Fantasy, Horror",TV,12,7.39,253027
1977,8068,Kuroshitsuji Picture Drama,"Demons, Supernatural",Special,1,7.39,12446
1978,17247,Machine-Doll wa Kizutsukanai,"Action, Ecchi, Fantasy, School, Seinen",TV,12,7.39,136751
1979,30307,Monster Musume no Iru Nichijou,"Comedy, Ecchi, Fantasy, Harem, Romance, Seinen",TV,12,7.39,181845
1980,6512,Nyan Koi!,"Comedy, Harem, Romance",TV,12,7.39,142264
1982,418,Ranma ½: Chuugoku Nekonron Daikessen! Okite Yaburi no Gekitou-hen!!,"Adventure, Comedy, Shounen",Movie,1,7.39,13073
1985,1231,Saber Marionette J to X,"Action, Adventure, Comedy, Harem, Mecha, Sci-Fi",TV,26,7.39,8862
1986,16694,Sankarea: Wagahai mo... Zombie de Aru...,"Comedy, Ecchi, Horror, Romance, Shounen, Supernatural",Special,1,7.39,36573
1987,3861,Shaman King Specials,"Action, Comedy, Shounen, Supernatural",Special,5,7.39,12148
1988,536,Slayers: The Motion Picture,"Adventure, Comedy, Fantasy, Magic, Shounen",Movie,1,7.39,16046
1989,1147,Tenchi Muyou! Ryououki 3rd Season: Tenchi Seirou naredo Namitakashi?,"Action, Comedy, Harem, Sci-Fi, Shounen, Space",OVA,1,7.39,6870
1991,807,Tsubasa Chronicle: Tori Kago no Kuni no Himegimi,"Action, Adventure, Drama, Fantasy, Shounen",Movie,1,7.39,33633
1992,306,Abenobashi Mahou☆Shoutengai,"Comedy, Ecchi, Fantasy, Parody",TV,13,7.38,47752
1993,32977,Aggressive Retsuko,"Comedy, Music",TV,0,7.38,5465
1994,282,Angel Heart,"Action, Drama, Mystery, Romance, Seinen",TV,50,7.38,9550
1995,11697,Area no Kishi,"Comedy, School, Shounen, Sports",TV,37,7.38,38310
1996,104,Ayashi no Ceres,"Adventure, Comedy, Drama, Horror, Psychological, Romance, Shoujo, Supernatural",TV,24,7.38,38336
1997,24727,Baka to Test to Shoukanjuu Ni!: Mahou Hideyoshi Hideyoshi,"Comedy, Magic",Special,1,7.38,9418
1998,6948,Bakemonogatari Recap,"Mystery, Romance, Supernatural",Special,1,7.38,28557
1999,5675,Basquash!,"Ecchi, Mecha, Shounen, Sports",TV,26,7.38,30323
2000,1521,Black Jack the Movie,Drama,Movie,1,7.38,6404
2002,2597,Detective Conan OVA 07: A Challenge from Agasa! Agasa vs. Conan and the Detective Boys,"Adventure, Comedy, Mystery, Police, Shounen",OVA,1,7.38,7627
2004,1858,Gakuen Utopia Manabi Straight!,"Comedy, School, Slice of Life",TV,12,7.38,19315
2005,411,Gun x Sword,"Action, Adventure, Drama, Mecha, Sci-Fi, Shounen",TV,26,7.38,45921
2006,14645,Hiiro no Kakera Dai Ni Shou,"Fantasy, Romance, Shoujo, Supernatural",TV,13,7.38,26617
2008,1374,Kyoushoku Soukou Guyver (2005),"Adventure, Sci-Fi, Shounen",TV,26,7.38,12337
2011,2152,Oh! Edo Rocket,"Comedy, Drama, Fantasy, Historical, Sci-Fi",TV,26,7.38,8221
2012,7769,Ookami-san to Shichinin no Nakama-tachi,"Comedy, Parody, Romance",TV,12,7.38,145982
2013,33190,Planetarian: Hoshi no Hito,Magic,Movie,1,7.38,9461
2014,10448,Rain Town,Drama,ONA,1,7.38,12489
2016,4618,RideBack,"Action, Drama, Mecha, School, Sci-Fi",TV,12,7.38,32835
2017,10884,Saki Achiga-hen: Episode of Side-A,"Game, School, Slice of Life",TV,12,7.38,22358
2018,4015,School Rumble San Gakki,"Comedy, Romance, School, Shounen",OVA,2,7.38,41898
2019,4581,Shikabane Hime: Aka,"Action, Horror, Martial Arts",TV,13,7.38,71502
2020,152,Solty Rei,"Action, Sci-Fi, Super Power",TV,24,7.38,17943
2021,75,Soukyuu no Fafner: Dead Aggressor,"Action, Drama, Mecha, Military, Sci-Fi",TV,25,7.38,27516
2022,341,Spiral: Suiri no Kizuna,"Drama, Mystery, Shounen",TV,25,7.38,36187
2023,30344,The iDOLM@STER Cinderella Girls 2nd Season,"Comedy, Drama, Music",TV,12,7.38,16736
2025,3088,Tokyo Marble Chocolate,"Romance, Slice of Life",OVA,2,7.38,15425
2026,712,Zoids Genesis,"Action, Adventure, Comedy, Mecha, Military",TV,50,7.38,9559
2027,9117,Amagami SS OVA,"Romance, School",OVA,6,7.37,31010
2028,1278,Bishoujo Senshi Sailor Moon SuperS Gaiden: Ami-chan no Hatsukoi,"Comedy, Magic, Romance, Shoujo",Special,1,7.37,15135
2029,1674,Captain Tsubasa J,"Action, Shounen, Sports",TV,47,7.37,13927
2032,3627,D.C.II S.S.: Da Capo II Second Season,"Comedy, Drama, Fantasy, Harem, Romance",TV,13,7.37,20581
2033,1369,Detective Conan OVA 01: Conan vs. Kid vs. Yaiba,"Adventure, Comedy, Mystery, Shounen",OVA,1,7.37,10294
2034,2515,Detective Conan OVA 05: The Target is Kogoro! The Detective Boys&#039; Secret Investigation,"Adventure, Comedy, Mystery, Police, Shounen",OVA,1,7.37,7666
2035,1313,Digimon Adventure 02,"Action, Adventure, Comedy, Drama, Fantasy, Kids",TV,50,7.37,120268
2037,381,Fushigi Yuugi OVA 2,"Adventure, Drama, Fantasy, Historical, Martial Arts, Romance, Shoujo",OVA,6,7.37,13508
2039,655,Galaxy Angel 4,"Comedy, Sci-Fi",TV,13,7.37,5046
2041,3485,Ghost in the Shell: Stand Alone Complex 2nd GIG - Tachikoma na Hibi,"Comedy, Mecha, Sci-Fi",Special,26,7.37,14240
2042,32740,Girls und Panzer der Film: Arisu War!,"Military, School",Special,1,7.36,6548
2043,11077,Hellsing: The Dawn,"Action, Horror, Seinen, Supernatural, Vampire",Special,3,7.37,40548
2044,31326,High School DxD BorN: Ishibumi Ichiei Kanzen Kanshuu! Mousou Bakuyou Kaijo Original Video,"Comedy, Ecchi",Special,6,7.37,18288
2045,13357,High School DxD Specials,"Comedy, Demons, Ecchi, Harem, Romance, School",Special,6,7.37,75439
2046,10189,Hunter x Hunter Pilot,"Action, Adventure, Shounen, Super Power",OVA,1,7.37,10375
2048,15735,Jormungand: Perfect Order - First Stage Soushuuhen,"Action, Adventure, Seinen",Special,1,7.37,6522
2050,21863,Mangaka-san to Assistant-san to The Animation,"Comedy, Ecchi, Harem, Seinen, Slice of Life",TV,12,7.37,108642
2051,24475,Mangaka-san to Assistant-san to The Animation Specials,"Comedy, Ecchi, Harem, Seinen, Slice of Life",Special,6,7.37,21564
2053,1969,Mobile Suit Zeta Gundam: A New Translation III - Love Is the Pulse of the Stars,"Drama, Mecha, Military, Sci-Fi, Space",Movie,1,7.37,5705
2054,8857,Nichijou: Nichijou no 0-wa,"Comedy, School, Slice of Life",OVA,1,7.37,37342
2055,2020,One Piece: Nenmatsu Tokubetsu Kikaku! Mugiwara no Luffy Oyabun Torimonochou,"Adventure, Comedy, Fantasy, Shounen",Special,1,7.37,18307
2056,9888,Shinryaku! Ika Musume Specials,Comedy,Special,2,7.37,14497
2057,4028,Slayers Revolution,"Adventure, Comedy, Fantasy",TV,13,7.37,23679
2058,1965,Sola,"Drama, Romance, Slice of Life, Supernatural",TV,13,7.37,71172
2059,8934,Star Driver: Kagayaki no Takuto,"Action, Mecha, Romance, Shounen",TV,25,7.37,66084
2060,19021,Takanashi Rikka Kai: Chuunibyou demo Koi ga Shitai! Movie,"Comedy, Drama, Romance, School, Slice of Life",Movie,1,7.37,34272
2061,10321,Uta no☆Prince-sama♪ Maji Love 1000%,"Comedy, Harem, Music, Romance, School, Shoujo",TV,13,7.37,105723
2062,31178,Uta no☆Prince-sama♪ Maji Love Legend Star,"Comedy, Harem, Music, Romance, Shoujo",TV,13,7.37,12757
2063,20359,Yamada-kun to 7-nin no Majo,"Comedy, School, Shounen, Supernatural",ONA,1,7.37,23937
2064,975,Yokohama Kaidashi Kikou,"Sci-Fi, Seinen, Slice of Life",OVA,2,7.37,12389
2065,9332,.hack//Quantum,"Action, Adventure, Fantasy, Game, Sci-Fi",OVA,3,7.36,26163
2066,1347,Bubblegum Crisis,"Adventure, Mecha, Sci-Fi, Shounen",OVA,8,7.36,17268
2067,12293,Campione!: Matsurowanu Kamigami to Kamigoroshi no Maou,"Comedy, Ecchi, Fantasy, Harem, Magic, Romance",TV,13,7.36,151928
2068,3087,Cencoroll,"Action, Sci-Fi",Movie,1,7.36,56370
2070,1678,Cyborg 009: The Cyborg Soldier,"Action, Adventure, Mecha, Sci-Fi, Shounen",TV,52,7.36,14867
2072,902,Dragon Ball Z Movie 09: Ginga Girigiri!! Bucchigiri no Sugoi Yatsu,"Adventure, Comedy, Fantasy, Sci-Fi, Shounen",Movie,1,7.36,51083
2074,16700,Higurashi no Naku Koro ni Kaku: Outbreak,"Horror, Mystery, Psychological, Thriller",OVA,1,7.36,33381
2075,14765,Ixion Saga DT,"Action, Comedy, Fantasy",TV,25,7.36,52569
2076,16035,Karneval (TV),"Action, Fantasy, Mystery, Sci-Fi, Shoujo",TV,13,7.36,108174
2078,15379,Kotoura-san,"Comedy, Drama, Romance, School",TV,12,7.36,123691
2079,32871,Kuroko no Basket Movie 3: Winter Cup Soushuuhen - Tobira no Mukou,"Comedy, Shounen, Sports",Movie,1,7.38,5492
2080,3577,Kyouran Kazoku Nikki,"Comedy, Sci-Fi",TV,26,7.36,20883
2081,1013,Le Chevalier D&#039;Eon,"Historical, Magic, Mystery, Seinen, Supernatural",TV,24,7.36,33035
2082,190,Love Hina Again,"Comedy, Drama, Ecchi, Romance, Shounen",OVA,3,7.36,61154
2083,963,"Love Hina: Motoko no Sentaku, Koi ka Ken... &quot;Naku na&quot;","Drama, Romance, Slice of Life",Special,1,7.36,28222
2084,1609,Mai-Otome Zwei,"Action, Magic",OVA,4,7.36,14615
2086,8424,MM!,"Comedy, Ecchi, Harem, School",TV,12,7.36,129672
2087,94,Mobile Suit Gundam Seed Destiny,"Action, Drama, Mecha, Military, Romance, Sci-Fi, Space",TV,50,7.36,65896
2088,13585,Natsuyuki Rendezvous,"Drama, Josei, Romance, Supernatural",TV,11,7.36,40958
2089,16143,One Piece: Kinkyuu Kikaku One Piece Kanzen Kouryakuhou,"Adventure, Comedy, Fantasy, Shounen",Special,1,7.36,5914
2090,31918,Owari no Seraph: Nagoya Kessen-hen - Owaranai Seraph - Nagoya Kessen-hen,"Comedy, Parody, Shounen",Special,4,7.36,11400
2091,9893,Suite Precure♪,"Action, Fantasy, Magic, Shoujo",TV,48,7.36,7314
2092,16868,Sukitte Ii na yo.: Dareka ga,"Romance, School, Shoujo",OVA,1,7.36,27802
2093,6758,Tatakau Shisho: The Book of Bantorra,"Action, Fantasy, Seinen, Super Power",TV,27,7.36,35520
2094,415,Tonari no Yamada-kun,"Comedy, Slice of Life",Movie,1,7.36,16442
2095,7,Witch Hunter Robin,"Action, Drama, Magic, Mystery, Police, Supernatural",TV,26,7.36,64905
2096,976,Yokohama Kaidashi Kikou: Quiet Country Cafe,"Sci-Fi, Seinen, Slice of Life",OVA,2,7.36,7609
2098,30870,Ajin Part 3: Shougeki,"Action, Horror, Mystery, Seinen, Supernatural",Movie,1,7.36,9638
2099,17901,All Alone With You,"Fantasy, Music",Music,1,7.35,7612
2100,9925,Amagami SS: Tachibana Miya-hen - Imouto,School,Special,1,7.35,31019
2101,30206,Amagi Brilliant Park: Nonbirishiteiru Hima ga Nai!,Comedy,Special,1,7.35,30342
2102,2116,Captain Tsubasa,"Action, Shounen, Sports",TV,128,7.35,36623
2103,1723,Clannad Movie,"Drama, Fantasy, Romance, School",Movie,1,7.35,99506
2104,61,D.N.Angel,"Action, Comedy, Fantasy, Magic, Romance, School, Shoujo",TV,26,7.35,126914
2105,31163,Dimension W,"Action, Sci-Fi, Seinen",TV,12,7.36,130028
2106,3230,Druaga no Tou: The Aegis of Uruk,"Adventure, Comedy, Fantasy",TV,12,7.35,69683
2108,19951,Hunter x Hunter Movie: The Last Mission,"Action, Adventure, Shounen, Super Power",Movie,1,7.35,37633
2111,3229,Kimi ga Aruji de Shitsuji ga Ore de,"Comedy, Ecchi, Harem, Parody, Romance",TV,13,7.35,66236
2114,1516,Kirarin☆Revolution,"Comedy, Drama, Romance, Shoujo",TV,153,7.35,14932
2115,32245,Kuromukuro,"Action, Mecha, Sci-Fi",TV,26,7.35,46323
2117,1967,Mobile Suit Zeta Gundam: A New Translation - Heir to the Stars,"Drama, Mecha, Military, Sci-Fi, Space",Movie,1,7.35,6326
2118,3467,Nogizaka Haruka no Himitsu,"Comedy, Romance",TV,12,7.35,80820
2119,16468,One Piece: Glorious Island,"Action, Adventure, Comedy, Fantasy, Shounen, Super Power",Special,2,7.35,12922
2120,2385,One Piece: Jango no Dance Carnival,"Comedy, Fantasy, Shounen",Movie,1,7.35,22157
2121,195,Onegai☆Teacher,"Comedy, Drama, Romance, School, Sci-Fi",TV,12,7.35,99558
2122,3887,Ookiku Furikabutte Special,"Drama, Sports",Special,1,7.35,8478
2123,30714,Owari no Seraph: Owaranai Seraph,"Comedy, Police, Shounen, Supernatural, Vampire",Special,9,7.35,22823
2125,21073,Puchimas!!: Petit Petit iDOLM@STER,"Comedy, Slice of Life",ONA,74,7.35,5359
2126,25647,Sabagebu! Specials,"Action, Comedy, Military, Shoujo",Special,6,7.35,9065
2127,13055,Sankarea OVA,"Comedy, Ecchi, Horror, Romance, Shounen, Supernatural",OVA,2,7.35,51997
2129,28621,Subete ga F ni Naru: The Perfect Insider,"Mystery, Psychological, Sci-Fi",TV,11,7.35,81230
2130,9241,Super Robot Taisen OG: The Inspector,"Action, Mecha, Sci-Fi, Space",TV,26,7.35,5962
2131,390,Suzuka,"Drama, Romance, Sports",TV,26,7.35,64161
2132,21881,Sword Art Online II,"Action, Adventure, Fantasy, Game, Romance",TV,24,7.35,537892
2133,16417,Tamako Market,"Comedy, Slice of Life",TV,12,7.35,128529
2134,2500,The Cockpit,"Historical, Military",OVA,3,7.35,5053
2135,30901,Utawarerumono: Itsuwari no Kamen,"Action, Drama, Fantasy",TV,25,7.35,55851
2136,13677,Ao no Exorcist Movie Special,"Comedy, Parody",Special,1,7.34,20543
2137,9120,Beelzebub: Hirotta Akachan wa Daimaou!?,"Action, Comedy, Demons, School, Shounen, Supernatural",Special,1,7.34,21212
2138,8915,Dantalian no Shoka,"Action, Historical, Mystery, Supernatural",TV,12,7.34,84779
2142,376,Elfen Lied Special,"Drama, Ecchi, Horror, Psychological, Supernatural",Special,1,7.34,116129
2143,1126,Figure 17: Tsubasa &amp; Hikaru,"Sci-Fi, Slice of Life",TV,13,7.34,6860
2144,1524,Fuujin Monogatari,"Drama, Fantasy, School, Slice of Life, Supernatural",TV,13,7.34,8717
2145,21635,GJ-bu@,"Comedy, School, Slice of Life",Special,1,7.34,18894
2147,27945,Gugure! Kokkuri-san Specials,"Comedy, Romance, Shounen, Supernatural",Special,11,7.34,5870
2148,958,HeatGuy J,"Action, Adventure, Mecha, Police, Sci-Fi",TV,25,7.34,10727
2149,4550,Hyakko,"Comedy, School, Slice of Life",TV,13,7.34,33112
2150,25159,Inou-Battle wa Nichijou-kei no Naka de,"Comedy, Romance, School, Slice of Life, Supernatural",TV,12,7.34,144370
2152,634,Koi Kaze,"Drama, Psychological, Romance, Seinen",TV,13,7.34,41250
2155,28013,Macross Δ,"Action, Mecha, Military, Music, Romance, Sci-Fi, Space",TV,26,7.34,30308
2158,11033,"Natsu-iro Egao de 1, 2, Jump!",Music,Music,1,7.34,6939
2159,19653,Neppuu Kairiku Bushi Road,"Action, Fantasy, Mecha, Sci-Fi",Special,1,7.34,19967
2160,9999,One Piece 3D: Mugiwara Chase,"Action, Adventure, Comedy, Fantasy, Shounen",Movie,1,7.34,23772
2161,8171,One Piece Recap,"Action, Adventure, Comedy, Fantasy, Shounen, Super Power",OVA,1,7.34,10147
2162,2386,One Piece: Yume no Soccer Ou!,"Comedy, Fantasy, Shounen, Sports",Movie,1,7.34,23915
2163,107,Ou Dorobou Jing,"Adventure, Comedy, Fantasy, Sci-Fi, Shounen",TV,13,7.34,21920
2164,2847,Pokemon Diamond &amp; Pearl: Dialga vs. Palkia vs. Darkrai,"Action, Adventure, Comedy, Drama, Fantasy, Kids",Movie,1,7.34,38238
2166,28495,Sidonia no Kishi Movie,"Action, Mecha, Sci-Fi, Seinen, Space",Movie,1,7.34,5472
2167,173,Tactics,"Comedy, Drama, Fantasy, Mystery, Shounen, Super Power",TV,25,7.34,27358
2168,1303,The Animatrix,"Action, Drama, Sci-Fi",OVA,9,7.34,42831
2169,3455,To LOVE-Ru,"Comedy, Ecchi, Harem, Romance, School, Sci-Fi",TV,26,7.34,237563
2170,4896,Umineko no Naku Koro ni,"Horror, Mystery, Psychological, Supernatural",TV,26,7.34,126865
2171,883,Yuu☆Yuu☆Hakusho: Meikai Shitou-hen - Honoo no Kizuna,"Action, Comedy",Movie,1,7.34,13775
2173,32323,Aishen Qiaokeli-ing...,"Comedy, Harem, Romance, School",ONA,15,7.33,11936
2174,12669,Amagami SS+ Plus Specials,Romance,Special,6,7.33,17764
2175,31754,Aoharu x Kikanjuu: Kemono-tachi no Senjou da na!,"Action, Comedy, Shounen",Special,1,7.33,13993
2176,1205,Aru Tabibito no Nikki,"Adventure, Fantasy",ONA,6,7.33,15565
2177,10681,Blood-C: The Last Dark,"Action, Horror, Supernatural, Vampire",Movie,1,7.33,37925
